{
  "schema_version": 1,
  "id": "3e1fcbaf94f7cb24004161b6bea4436991d05efa01ae61f88de74d3bd2c407d2",
  "published_date": "2023-06-01",
  "regulator": "SFC",
  "pillar": ["exchanges_vatp"],
  "type": "circular",
  "title": "Licensing regime for virtual asset trading platforms comes into effect",
  "summary": "Centralised virtual asset trading platforms operating in Hong Kong, or actively marketing to Hong Kong investors, must be licensed and regulated by the Securities and Futures Commission. Two parallel licensing routes apply: a Securities and Futures Ordinance licence, covering Type 1 (dealing in securities) and Type 7 (automated trading services) regulated activities, for platforms that trade at least one security token; and an Anti-Money Laundering and Counter-Terrorist Financing Ordinance licence, required of every centralised virtual asset exchange regardless of what it trades. Because a token's legal classification can shift between non-security and security status over time, the SFC states it would be appropriate for platforms to apply for licences under both regimes, to avoid inadvertently breaching either one and to maintain business continuity. This dual-licence structure has applied since the regime's commencement in June 2023.",
  "why_it_matters": "This is the legal foundation for every licensed virtual asset exchange serving Hong Kong investors, and explains why a single platform may need two separate licences rather than one.",
  "key_dates": {
    "effective": "2023-06-01"
  },
  "citations": [
    {
      "url": "https://www.sfc.hk/en/Welcome-to-the-Fintech-Contact-Point/Virtual-assets/Virtual-asset-trading-platforms-operators",
      "quote": "are required to be licensed and regulated by the SFC"
    }
  ],
  "status": "unverified",
  "generated_at": "2026-07-09T08:00:00Z",
  "model": "claude-sonnet-5"
}
